,,Multi-task autoencoder for noise-robust speech recognition,T,10652,124,13.0,"H Zhang, C Liu, N Inoue…",2018.0,2018 IEEE International …,ieeexplore.ieee.org,https://ieeexplore.ieee.org/abstract/document/8461446/?casa_token=F_VBJIyu3cYAAAAA:0_NH3yNFhwVcTd-5y6WSTlXEeM8tGGDWNrbwJ1ZbY25BpqBd0ns4ZJPHZqXLnDkhBJaenYLhqQ,https://scholar.google.com/scholar?cites=13239037729015928699&as_sdt=2005&sciodt=2007&hl=en,100.0,2022-07-14 11:17:40,,,,,,,,,13,3.25,3.0,4.0,4.0,… Its input is the noisy-speech feature and the output is the noise feature. The training … noise features and noise features to learn the mapping function from noisy-speech features to noise …,https://ieeexplore.ieee.org/iel7/8450881/8461260/08461446.pdf?casa_token=zKWvDvyLe6YAAAAA:mSnUQaHSi3PmusvRJgr2wmAHGeNEq7NqHPApbskylIOJXQdhNdsMb4lcPtktLBanmaLNFTykNg,https://scholar.google.com/scholar?q=related:exf9zauCurcJ:scholar.google.com/&scioq=%22robust%22+%22machine+learning%22+%22noise%22&hl=en&as_sdt=2007,,,,,,,,,,,,,,,,,,,,,,,,,,,,,,,
,,Multiclass Capped ℓp-Norm SVM for Robust Classifications,T,10684,181,45.0,"F. Nie, Xiaoqian Wang, Heng Huang",2017.0,,,,,182.0,2022-07-13 10:05:55,,10.1609/aaai.v31i1.10948,,,,,,,45,9.0,15.0,3.0,5.0,"    Support vector machine (SVM) model is one of most successful machine learning methods and has been successfully applied to solve numerous real-world application. Because the SVM methods use the hinge loss or squared hinge loss functions for classifications, they usually outperform other classification approaches, e.g. the least square loss function based methods. However, like most supervised learning algorithms, they learn classifiers based on the labeled data in training set without specific strategy to deal with the noise data. In many real-world applications, we often have data outliers in train set, which could misguide the classifiers learning, such that the classification performance is suboptimal. To address this problem, we proposed a novel capped Lp-norm SVM classification model by utilizing the capped `p-norm based hinge loss in the objective which can deal with both light and heavy outliers. We utilize the new formulation to naturally build the multiclass capped Lp-norm SVM. More importantly, we derive a novel optimization algorithms to efficiently minimize the capped Lp-norm based objectives, and also rigorously prove the convergence of proposed algorithms. We present experimental results showing that employing the new capped Lp-norm SVM method can consistently improve the classification performance, especially in the cases when the data noise level increases.   ",,,,,,,,,,,,,,,,,,,,,,,,,,,,,,,,,
,,Multiplicative Reweighting for Robust Neural Network Optimization,T,10797,109,2.0,"N Bar, T Koren, R Giryes",2021.0,arXiv preprint arXiv:2102.12192,arxiv.org,https://arxiv.org/abs/2102.12192,https://scholar.google.com/scholar?cites=12532419046958263828&as_sdt=2005&sciodt=2007&hl=en,110.0,2022-07-14 12:55:58,,,,,,,,,2,2.0,1.0,3.0,1.0,"… (MW) updates were recently shown to be robust to moderate data corruptions in expert advice, … same confidence so we want to learn a weighted (non-uniformly averaged) loss function: …",https://arxiv.org/pdf/2102.12192,https://scholar.google.com/scholar?q=related:FG5JPrkY7K0J:scholar.google.com/&scioq=%22robust%22+%22neural+network%22+%22confidence%22&hl=en&as_sdt=2007,,,,,,,,,,,,,,,,,,,,,,,,,,,,,,,
,,Multiway Cluster Robust Double/Debiased Machine Learning,T,10850,12,18.0,"Harold D. Chiang, Kengo Kato, Yukun Ma, Yuya Sasaki",2019.0,,,,,13.0,2022-07-13 10:06:20,,10.1080/07350015.2021.1895815,,,,,,,18,6.0,5.0,4.0,3.0,"Abstract This article investigates double/debiased machine learning (DML) under multiway clustered sampling environments. We propose a novel multiway cross-fitting algorithm and a multiway DML estimator based on this algorithm. We also develop a multiway cluster robust standard error formula. Simulations indicate that the proposed procedure has favorable finite sample performance. Applying the proposed method to market share data for demand analysis, we obtain larger two-way cluster robust standard errors for the price coefficient than nonrobust ones in the demand model.",,,,,,,,,,,,,,,,,,,,,,,,,,,,,,,,,
,,Network Robustness via Global k-cores,T,10967,179,2.0,"P Dey, SK Maity, S Medya, A Silva",2020.0,arXiv preprint arXiv:2012.10036,arxiv.org,https://arxiv.org/abs/2012.10036,https://scholar.google.com/scholar?cites=6409880264659078295&as_sdt=2005&sciodt=2007&hl=en,180.0,2022-07-12 13:42:35,,,,,,,,,2,1.0,1.0,4.0,2.0,"… correlated with network resilience. In this section, we evaluate how k-core robustness can help us … K-core Resilience: We propose a resilience metric similar to the one defined above but …",https://arxiv.org/pdf/2012.10036,https://scholar.google.com/scholar?q=related:l4zKwyN49FgJ:scholar.google.com/&scioq=%22robustness%22+%22artificial+intelligence%22+%22resilience%22&hl=en&as_sdt=2007,,,,,,,,,,,,,,,,,,,,,,,,,,,,,,,
,,"Network robustness as a mathematical property: training, evaluation and attack",T,10974,86,0.0,"M Casadio, ML Daggitt, E Komendantskaya, W Kokke…",2021.0,,openreview.net,https://openreview.net/forum?id=VAmkgdMztWs,,102.0,2022-07-13 12:01:57,,,,,,,,,0,0.0,0.0,5.0,1.0,"… that the network obeys understandable constraints, it improves the explainability of the neural network. Each of the robustness constraints encode that “small changes to the input only …",https://openreview.net/pdf?id=VAmkgdMztWs,https://scholar.google.com/scholar?q=related:W2R-569uNuoJ:scholar.google.com/&scioq=%22robustness%22+%22neural+network%22+%22explainability%22&hl=en&as_sdt=2007,,,,,,,,,,,,,,,,,,,,,,,,,,,,,,,
,,Networking the boids is more robust against adversarial learning,T,10980,51,13.0,"J Tang, G Leu, HA Abbass",2017.0,IEEE Transactions on Network …,ieeexplore.ieee.org,https://ieeexplore.ieee.org/abstract/document/8017654/,https://scholar.google.com/scholar?cites=3196135145250209881&as_sdt=2005&sciodt=2007&hl=en,52.0,2022-07-13 17:19:08,,,,,,,,,13,2.6,4.0,3.0,5.0,"… We further investigate the effect of adversarial learning, whereby an observer attempts to … robust approach against adversarial learning than local-proximity neighborhood structure. …",https://arxiv.org/pdf/1802.10206,https://scholar.google.com/scholar?q=related:WcDHEvvzWiwJ:scholar.google.com/&scioq=%22robust%22+%22artificial+intelligence%22+%22adversarial%22&hl=en&as_sdt=2007,,,,,,,,,,,,,,,,,,,,,,,,,,,,,,,
,,NeuRoRA: Neural Robust Rotation Averaging,T,10987,37,23.0,"Pulak Purkait, Tat-Jun Chin, I. Reid",2019.0,,,,,38.0,2022-07-13 10:10:34,,10.1007/978-3-030-58586-0_9,,,,,,,23,8.07,8.0,3.0,3.0,,,,,,,,,,,,,,,,,,,,,,,,,,,,,,,,,,
,,Neural Network Regularization via Robust Weight Factorization,T,11052,122,5.0,"Jan Rudy, Weiguang Ding, Daniel Jiwoong Im, Graham W. Taylor",2014.0,,,,,123.0,2022-07-13 10:08:47,,,,,,,,,5,1.03,1.0,4.0,8.0,"Regularization is essential when training large neural networks. As deep neural networks can be mathematically interpreted as universal function approximators, they are effective at memorizing sampling noise in the training data. This results in poor generalization to unseen data. Therefore, it is no surprise that a new regularization technique, Dropout, was partially responsible for the now-ubiquitous winning entry to ImageNet 2012 by the University of Toronto. Currently, Dropout (and related methods such as DropConnect) are the most effective means of regularizing large neural networks. These amount to efficiently visiting a large number of related models at training time, while aggregating them to a single predictor at test time. The proposed FaMe model aims to apply a similar strategy, yet learns a factorization of each weight matrix such that the factors are robust to noise.",,,,,,,,,,,,,,,,,,,,,,,,,,,,,,,,,
,,Neural Network Robustness Verification on GPUs,T,11057,2,13.0,"Christoph Müller, Gagandeep Singh, Markus Püschel, Martin T. Vechev",2020.0,,,,,3.0,2022-07-13 09:26:25,,,,,,,,,13,6.5,3.0,4.0,2.0,"Certifying the robustness of neural networks against adversarial attacks is critical to their reliable adoption in real-world systems including autonomous driving and medical diagnosis. Unfortunately, state-of-the-art verifiers either do not scale to larger networks or are too imprecise to prove robustness, which limits their practical adoption. In this work, we introduce GPUPoly, a scalable verifier that can prove the robustness of significantly larger deep neural networks than possible with prior work. The key insight behind GPUPoly is the design of custom, sound polyhedra algorithms for neural network verification on a GPU. Our algorithms leverage the available GPU parallelism and the inherent sparsity of the underlying neural network verification task. GPUPoly scales to very large networks: for example, it can prove the robustness of a 1M neuron, 34-layer deep residual network in about 1 minute. We believe GPUPoly is a promising step towards the practical verification of large real-world networks.",,,,,,,,,,,,,,,,,,,,,,,,,,,,,,,,,
,,Neural Network Robustness through Obfuscation,T,11058,63,0.0,"M Wegman, H Qian, IM Molloy, T Lee…",2022.0,US Patent App. 17 …,Google Patents,https://patents.google.com/patent/US20220100847A1/en,,64.0,2022-07-13 09:08:01,,,,,,,,,0,0.0,0.0,5.0,1.0,"… program product, and computer implemented method to enhance robustness an artificial … BACKGROUND The present embodiments relate to an artificial intelligence platform and an …",https://patentimages.storage.googleapis.com/47/85/de/b4bef0383e9f58/US20220100847A1.pdf,,,,,,,,,,,,,,,,,,,,,,,,,,,,,,,,
,,Neural Network Spectral Robustness under Perturbations of the Underlying Graph,T,11059,22,45.0,A. Rădulescu,2016.0,,,,,23.0,2022-07-13 09:26:01,,10.1162/NECO_a_00798,,,,,,,45,7.5,45.0,1.0,6.0,"Recent studies have been using graph-theoretical approaches to model complex networks (such as social, infrastructural, or biological networks) and how their hardwired circuitry relates to their dynamic evolution in time. Understanding how configuration reflects on the coupled behavior in a system of dynamic nodes can be of great importance, for example, in the context of how the brain connectome is affecting brain function. However, the effect of connectivity patterns on network dynamics is far from being fully understood. We study the connections between edge configuration and dynamics in a simple oriented network composed of two interconnected cliques (representative of brain feedback regulatory circuitry). In this article our main goal is to study the spectra of the graph adjacency and Laplacian matrices, with a focus on three aspects in particular: (1) the sensitivity and robustness of the spectrum in response to varying the intra- and intermodular edge density, (2) the effects on the spectrum of perturbing the edge configuration while keeping the densities fixed, and (3) the effects of increasing the network size. We study some tractable aspects analytically, then simulate more general results numerically, thus aiming to motivate and explain our further work on the effect of these patterns on the network temporal dynamics and phase transitions. We discuss the implications of such results to modeling brain connectomics. We suggest potential applications to understanding synaptic restructuring in learning networks and the effects of network configuration on function of regulatory neural circuits.",,,,,,,,,,,,,,,,,,,,,,,,,,,,,,,,,
,,Neural architecture dilation for adversarial robustness,T,11100,195,2.0,"Y Li, Z Yang, Y Wang, C Xu",2021.0,Advances in Neural …,proceedings.neurips.cc,https://proceedings.neurips.cc/paper/2021/hash/f7664060cc52bc6f3d620bcedc94a4b6-Abstract.html,https://scholar.google.com/scholar?cites=9843129568378931723&as_sdt=2005&sciodt=2007&hl=en,196.0,2022-07-12 11:56:54,,,,,,,,,2,2.0,1.0,4.0,1.0,"… adversarial training, there is a trade-off between standard accuracy and adversarial robustness… , this paper aims to improve the adversarial robustness of the backbone CNNs that have …",https://proceedings.neurips.cc/paper/2021/file/f7664060cc52bc6f3d620bcedc94a4b6-Paper.pdf,https://scholar.google.com/scholar?q=related:C8pe-TDSmYgJ:scholar.google.com/&scioq=%22robustness%22+%22artificial+intelligence%22+%22adversarial%22&hl=en&as_sdt=2007,,,,,,,,,,,,,,,,,,,,,,,,,,,,,,,
,,Neural network adaptive beamforming for robust multichannel speech recognition,T,11129,182,116.0,"B Li, TN Sainath, RJ Weiss, KW Wilson, M Bacchiani",2016.0,,research.google,https://research.google/pubs/pub45399/,https://scholar.google.com/scholar?cites=5720028046313756098&as_sdt=2005&sciodt=2007&hl=en,183.0,2022-07-14 12:55:58,,,,,,,,,116,19.33,23.0,5.0,6.0,"… It analyzes the predictions together with inputs and model states to output a confidence score that scales down the feedback vectors when necessary. Second, we incorporate a …",https://research.google/pubs/pub45399.pdf,https://scholar.google.com/scholar?q=related:wpXNvTOfYU8J:scholar.google.com/&scioq=%22robust%22+%22neural+network%22+%22confidence%22&hl=en&as_sdt=2007,,,,,,,,,,,,,,,,,,,,,,,,,,,,,,,
,,Neural network learning and robust stabilization of nonlinear systems with dynamic uncertainties,T,11163,79,57.0,"D Wang, D Liu, C Mu, Y Zhang",2017.0,IEEE transactions on neural …,ieeexplore.ieee.org,https://ieeexplore.ieee.org/abstract/document/8053899/?casa_token=XCCur6KbitMAAAAA:fGrexo9Ta5v5M6nJPxkiQ7gSi51fgU3_if2exsTxCqzYHC7Pq8I_vN7fj9hjhexfcDlJVUBoxQ,https://scholar.google.com/scholar?cites=15945053477184644224&as_sdt=2005&sciodt=2007&hl=en,78.0,2022-07-14 12:19:18,,,,,,,,,57,11.4,14.0,4.0,5.0,"… In this paper, based on the neural network learning component, the robust stabilization … to accomplish robust stabilization for the original uncertain dynamics. The neural network weight …",https://ieeexplore.ieee.org/iel7/5962385/6104215/08053899.pdf?casa_token=ZY_lxLbAnzEAAAAA:cxJcqcqegF7X5MeyZQT17PK8nYOIGnlGeBqVTaNiHlImd2JYlHfpuhQtCxSaVwCMrlXnGp36HA,https://scholar.google.com/scholar?q=related:gKQyMKg1SN0J:scholar.google.com/&scioq=%22robust%22+%22neural+network%22+%22design%22&hl=en&as_sdt=2007,,,,,,,,,,,,,,,,,,,,,,,,,,,,,,,
,,Neural network robustness via binary activation,T,11176,47,0.0,"WM Severa, CM Vineyard, RA Dellana…",2021.0,US Patent App. 17 …,Google Patents,https://patents.google.com/patent/US20210350236A1/en,,113.0,2022-07-13 14:14:52,,,,,,,,,0,0.0,0.0,4.0,1.0,… A method of increasing neural network robustness. The method comprises defining an artificial neural network comprising a number of bounded ramp activation functions. The network …,https://patentimages.storage.googleapis.com/5d/ad/eb/94e0c96c9fe0cd/US20210350236A1.pdf,,,,,,,,,,,,,,,,,,,,,,,,,,,,,,,,
,,Neural networks in engineering design: Robust practical stability analysis,T,11218,60,1.0,T Stamov,2021.0,Cybern. Inf. Technol,cit.iict.bas.bg,https://cit.iict.bas.bg/CIT-2021/v-21-4/10341-Volume21_Issue_4-01_paper.pdf,https://scholar.google.com/scholar?cites=5709152302332389778&as_sdt=2005&sciodt=2007&hl=en,61.0,2022-07-13 17:18:06,PDF,,,,,,,,1,1.0,1.0,1.0,1.0,… witnessing artificial intelligence being … design practice problems starting from early stage design ideas to the final decision. One of the most challenging problems is related to the design …,https://cit.iict.bas.bg/CIT-2021/v-21-4/10341-Volume21_Issue_4-01_paper.pdf,https://scholar.google.com/scholar?q=related:kikgRcX7Ok8J:scholar.google.com/&scioq=%22robust%22+%22artificial+intelligence%22+%22design%22&hl=en&as_sdt=2007,,,,,,,,,,,,,,,,,,,,,,,,,,,,,,,
,,Neuro-Evolution and Robustness: A Case Study,T,11304,94,0.0,"M Weeks, V Patel",2018.0,"2018 IEEE Games, Entertainment, Media …",ieeexplore.ieee.org,https://ieeexplore.ieee.org/abstract/document/8516464/,,95.0,2022-07-12 11:49:54,,,,,,,,,0,0.0,0.0,2.0,4.0,"… “The booming field of artificial intelligence (AI) is grappling with a replication crisis, much … Another recent claim is that scientific research in artificial intelligence, and specifically in neural …",,https://scholar.google.com/scholar?q=related:s35IPrNzhKEJ:scholar.google.com/&scioq=%22robustness%22+%22artificial+intelligence%22+%22explanation%22&hl=en&as_sdt=2007,,,,,,,,,,,,,,,,,,,,,,,,,,,,,,,
,,Neurosymbolic AI: The 3rd Wave,T,11353,11,51.0,"A. Garcez, L. Lamb",2020.0,,,,,12.0,2022-07-13 09:31:23,,,,,,,,,51,25.5,26.0,2.0,2.0,"Current advances in Artificial Intelligence (AI) and Machine Learning (ML) have achieved unprecedented impact across research communities and industry. Nevertheless, concerns about trust, safety, interpretability and accountability of AI were raised by influential thinkers. Many have identified the need for well-founded knowledge representation and reasoning to be integrated with deep learning and for sound explainability. Neural-symbolic computing has been an active area of research for many years seeking to bring together robust learning in neural networks with reasoning and explainability via symbolic representations for network models. In this paper, we relate recent and early research results in neurosymbolic AI with the objective of identifying the key ingredients of the next wave of AI systems. We focus on research that integrates in a principled way neural network-based learning with symbolic knowledge representation and logical reasoning. The insights provided by 20 years of neural-symbolic computing are shown to shed new light onto the increasingly prominent role of trust, safety, interpretability and accountability of AI. We also identify promising directions and challenges for the next decade of AI research from the perspective of neural-symbolic systems.",,,,,,,,,,,,,,,,,,,,,,,,,,,,,,,,,
,,"Never trust, always verify: a roadmap for Trustworthy AI?",T,11357,162,0.0,"LN Tidjon, F Khomh",2022.0,arXiv preprint arXiv:2206.11981,arxiv.org,https://arxiv.org/abs/2206.11981,,163.0,2022-07-13 08:51:06,,,,,,,,,0,0.0,0.0,2.0,1.0,… HLEG) and European AI Alliance The Assessment List For Trustworthy Artificial Intelligence (ALTAI) For Self Assessment 7 human agency and oversight; technical robustness and safety …,https://arxiv.org/pdf/2206.11981,,,,,,,,,,,,,,,,,,,,,,,,,,,,,,,,
,,New Criteria for Global Robust Stability of Delayed Neural Networks With Norm-Bounded Uncertainties,T,11367,178,58.0,S. Arik,2014.0,,,,,179.0,2022-07-13 10:07:43,,10.1109/TNNLS.2013.2287279,,,,,,,58,7.25,58.0,1.0,8.0,"In this paper, we study the global asymptotic robust stability of delayed neural networks with norm-bounded uncertainties. By employing the Lyapunov stability theory and homeomorphic mapping theorem, we derive some new types of sufficient conditions ensuring the existence, uniqueness, and global asymptotic stability of the equilibrium point for the class of neural networks with discrete time delays under parameter uncertainties and with respect to continuous and slope-bounded activation functions. An important aspect of our results is their low computational complexity, as the reported results can be verified by checking some properties of symmetric matrices associated with the uncertainty sets of the network parameters. The obtained results are shown to be generalizations of some of the previously published corresponding results. Some comparative numerical examples are also constructed to compare our results with some closely related existing literature results.",,,,,,,,,,,,,,,,,,,,,,,,,,,,,,,,,
,,New Era for Robust Speech Recognition,T,11368,188,50.0,"S Watanabe, M Delcroix, F Metze…",2017.0,Springer International …,Springer,https://link.springer.com/content/pdf/10.1007/978-3-319-64680-0.pdf,https://scholar.google.com/scholar?cites=12340332932171268774&as_sdt=2005&sciodt=2007&hl=en,189.0,2022-07-14 12:10:31,,10.1007/978-3-319-64680-0,,,,,,,50,10.0,13.0,4.0,5.0,… issues of deep neural-network-based ASR. It provides an overview of robust ASR research … chapters and associates them with the different components of a robust ASR system. …,,https://scholar.google.com/scholar?q=related:poIfgGurQasJ:scholar.google.com/&scioq=%22robust%22+%22neural+network%22+%22explanation%22&hl=en&as_sdt=2007,,,,,,,,,,,,,,,,,,,,,,,,,,,,,,,
,,"New Frontiers in Federated Learning: Privacy, Fairness, Robustness, Personalization and Data Ownership",T,11370,125,0.0,"N Hoang, L Nguyen, PY Chen…",2021.0,Annual Conference …,research.ibm.com,https://research.ibm.com/publications/new-frontiers-in-federated-learning-privacy-fairness-robustness-personalization-and-data-ownership,,126.0,2022-07-12 11:55:13,,,,,,,,,0,0.0,0.0,4.0,1.0,"Federated Learning (FL) has recently emerged as the de facto framework for distributed machine learning (ML) that preserves the privacy of data, especially in the proliferation of mobile …",,,,,,,,,,,,,,,,,,,,,,,,,,,,,,,,,
,,New Results on Robust Finite-Time Passivity for Fractional-Order Neural Networks with Uncertainties,T,11376,108,27.0,"Mai Viet Thuan, D. C. Huong, Duong Thi Hong",2018.0,,,,,109.0,2022-07-13 10:07:43,,10.1007/s11063-018-9902-9,,,,,,,27,7.15,9.0,3.0,4.0,,,,,,,,,,,,,,,,,,,,,,,,,,,,,,,,,,
,,New results of stability analysis for a class of neutral-type neural network with mixed time delays,T,11404,187,11.0,"Deyou Liu, Yue Du",2015.0,,,,,188.0,2022-07-13 09:27:51,,10.1007/s13042-014-0302-9,,,,,,,11,1.57,6.0,2.0,7.0,,,,,,,,,,,,,,,,,,,,,,,,,,,,,,,,,,
,,"Next Wave Artificial Intelligence: Robust, Explainable, Adaptable, Ethical, and Accountable",T,11414,5,4.0,"OC Jenkins, D Lopresti, M Mitchell",2020.0,arXiv preprint arXiv:2012.06058,arxiv.org,https://arxiv.org/abs/2012.06058,https://scholar.google.com/scholar?cites=8590702538497924277&as_sdt=2005&sciodt=2007&hl=en,6.0,2022-07-12 13:35:23,,,,,,,,,4,2.0,1.0,3.0,2.0,… of decades of investment in artificial intelligence (AI) across our … to the next level in terms of robustness and trustworthiness. … Another potential benefit of incorporating human knowledge …,https://arxiv.org/pdf/2012.06058,https://scholar.google.com/scholar?q=related:tRw3enFOOHcJ:scholar.google.com/&scioq=%22robustness%22+%22artificial+intelligence%22+%22human+knowledge%22&hl=en&as_sdt=2007,,,,,,,,,,,,,,,,,,,,,,,,,,,,,,,
,,No subclass left behind: Fine-grained robustness in coarse-grained classification problems,T,11431,136,49.0,"N Sohoni, J Dunnmon, G Angus…",2020.0,Advances in Neural …,proceedings.neurips.cc,https://proceedings.neurips.cc/paper/2020/hash/e0688d13958a19e087e123148555e4b4-Abstract.html,https://scholar.google.com/scholar?cites=10068670017880921815&as_sdt=2005&sciodt=2007&hl=en,180.0,2022-07-13 09:30:22,,,,,,,,,49,24.5,12.0,4.0,2.0,"… The potential real-world impact of GEORGE, the approach we present in this work, is that it would allow machine learning practitioners to both measure and mitigate hidden stratification …",https://proceedings.neurips.cc/paper/2020/file/e0688d13958a19e087e123148555e4b4-Paper.pdf,https://scholar.google.com/scholar?q=related:1xZrAAkau4sJ:scholar.google.com/&scioq=%22robustness%22+%22machine+learning%22+%22explanation%22&hl=en&as_sdt=2007,,,,,,,,,,,,,,,,,,,,,,,,,,,,,,,
,,Node Feature Kernels Increase Graph Convolutional Network Robustness,T,11432,84,1.0,"MEA Seddik, C Wu, JF Lutzeyer…",2022.0,… Artificial Intelligence …,proceedings.mlr.press,https://proceedings.mlr.press/v151/el-amine-seddik22a.html,https://scholar.google.com/scholar?cites=3396819270477207757&as_sdt=2005&sciodt=2007&hl=en,85.0,2022-07-12 13:50:33,,,,,,,,,1,1.0,0.0,4.0,1.0,"… We observe that only when the node feature noise is five times larger than the graph structure noise (γ = 5), the addition of the node feature kernel stops to benefit the model …",https://proceedings.mlr.press/v151/el-amine-seddik22a/el-amine-seddik22a.pdf,https://scholar.google.com/scholar?q=related:zdj-HiHtIy8J:scholar.google.com/&scioq=%22robustness%22+%22artificial+intelligence%22+%22noise%22&hl=en&as_sdt=2007,,,,,,,,,,,,,,,,,,,,,,,,,,,,,,,
,,Noise Robustness in Aspect Extraction Task,T,11452,11,4.0,"Valentin Malykh, Taras Khakhulin",2018.0,,,,,12.0,2022-07-13 09:21:09,,10.1109/IC-AIAI.2018.8674450,,,,,,,4,1.0,2.0,2.0,4.0,"Aspect extraction from user reviews is one of the sources to make dialog systems, which are on the rise now. A typical user of a conversation system has no time to check the spelling or grammar in his or her utterances. Due to that user utterances contain typos and spelling errors, so the noise robustness should be considered as a significant feature of an aspect extraction model. We analyze noise-robustness of state-of-the-art Attention-Based Aspect Extraction technique and propose the extensions for this model, which lead to more robust behaviour in presence of typos. Experimental results demonstrate how suitable each of the complements to the model that uses the data containing typos.",,,,,,,,,,,,,,,,,,,,,,,,,,,,,,,,,
,,Noise immunity and robustness study of image recognition using a convolutional neural network,T,11456,31,2.0,"V Ziyadinov, M Tereshonok",2022.0,Sensors,mdpi.com,https://www.mdpi.com/1486738,https://scholar.google.com/scholar?cites=11753076321491086579&as_sdt=2005&sciodt=2007&hl=en,32.0,2022-07-13 11:05:20,,,,,,,,,2,2.0,1.0,2.0,1.0,"… robustness … machine learning—the work describes a largely simplified model, thereby summarizing its conclusions for most cases solved by neural networks and other machine learning …",https://www.mdpi.com/1424-8220/22/3/1241/htm,https://scholar.google.com/scholar?q=related:8-yH2KRQG6MJ:scholar.google.com/&scioq=%22robustness%22+%22machine+learning%22+%22noise%22&hl=en&as_sdt=2007,,,,,,,,,,,,,,,,,,,,,,,,,,,,,,,
