Classification Keywords,"Keep (Yes, No, Discussion)",Title,Consider (Y/N/T),,Unnamed: 2,Cites,Authors,Year,Source,Publisher,ArticleURL,CitesURL,GSRank,QueryDate,Type,DOI,ISSN,CitationURL,Volume,Issue,StartPage,EndPage,ECC,CitesPerYear,CitesPerAuthor,AuthorCount,Age,Abstract,FullTextURL,RelatedURL,Query,Papers,Citations,Years,Cites_Year,Cites_Paper,Cites_Author,Papers_Author,Authors_Paper,h_index,g_index,hc_index,hI_index,hI_norm,AWCR,AW_index,AWCRpA,e_index,hm_index,Cites_Author_Year,hI_annual,h_coverage,g_coverage,star_count,year_first,year_last,acc1,acc2,acc5,acc20,hA
"Pruning, Robust, Performance",Yes,""" Understanding Robustness Lottery"": A Comparative Visual Analysis of Neural Network Pruning Approaches",T,1,0,0.0,"Z Li, S Liu, X Yu, K Bhavya, J Cao, DJ Daniel…",2022.0,arXiv preprint arXiv …,arxiv.org,https://arxiv.org/abs/2206.07918,,13.0,2022-07-13 12:03:09,,,,,,,,,0,0.0,0.0,7.0,1.0,"… assumption that a well optimized neural network model reach to a function’… robustness in relationship to model’s internal representation. Particularly, our framework provides explanation …",https://arxiv.org/pdf/2206.07918,,,,,,,,,,,,,,,,,,,,,,,,,,,,,,,,
-,No,""" Weak AI"" is Likely to Never Become"" Strong AI"", So What is its Greatest Value for us?",T,2,33,6.0,B Liu,2021.0,arXiv preprint arXiv:2103.15294,arxiv.org,https://arxiv.org/abs/2103.15294,https://scholar.google.com/scholar?cites=9242209603106218192&as_sdt=2005&sciodt=2007&hl=en,34.0,2022-07-13 17:51:51,,,,,,,,,6,6.0,6.0,1.0,1.0,"… a big challenge is how to model “unknown unknowns”; it will perform more automatically through eg… Marcus, “The next decade in AI: four steps towards robust artificial intelligence,” arXiv …",https://arxiv.org/pdf/2103.15294,https://scholar.google.com/scholar?q=related:0KDZrKrsQoAJ:scholar.google.com/&scioq=%22robust%22+%22artificial+intelligence%22+%22unknowns%22&hl=en&as_sdt=2007,,,,,,,,,,,,,,,,,,,,,,,,,,,,,,,
"Transparency, Reliability, Fairness, Explainability",Discussion,""" Why Should You Trust My Explanation?"" Understanding Uncertainty in LIME Explanations",T,3,186,30.0,"Y Zhang, K Song, Y Sun, S Tan, M Udell",2019.0,arXiv preprint arXiv:1904.12991,arxiv.org,https://arxiv.org/abs/1904.12991,https://scholar.google.com/scholar?cites=7508349093468144835&as_sdt=2005&sciodt=2007&hl=en,187.0,2022-07-13 10:02:07,,,,,,,,,30,10.0,6.0,5.0,3.0,… black-box machine learning models aim to increase the transparency of these model and … and raises concern about the model’s robustness. Focusing on a particular local explanations …,https://arxiv.org/pdf/1904.12991,https://scholar.google.com/scholar?q=related:w4TLNbgDM2gJ:scholar.google.com/&scioq=%22robustness%22+%22machine+learning%22+%22transparency%22&hl=en&as_sdt=2007,,,,,,,,,,,,,,,,,,,,,,,,,,,,,,,
"Learning-Enabled System, Uncertainty, Deep Learning",Yes,"""know What You Know"": Predicting Behavior for Learning-Enabled Systems When Facing Uncertainty",T,12,111,2.0,M.A. Langford,2021.0,"Proceedings - 2021 International Symposium on Software Engineering for Adaptive and Self-Managing Systems, SEAMS 2021",,,https://www.scopus.com/inward/citedby.uri?partnerID=HzOxMe3b&scp=85113514072&origin=inward,112.0,2022-07-12 16:26:44,Conference Paper,10.1109/SEAMS51251.2021.00020,,https://api.elsevier.com/content/abstract/scopus_id/85113514072,,,78.0,89.0,2,2.0,2.0,1.0,1.0,,,,,,,,,,,,,,,,,,,,,,,,,,,,,,,,,,
"Adversarial Perturbation, Smoothing",Yes,(Certified!!) Adversarial Robustness for Free!,T,17,9,0.0,"N Carlini, F Tramer, JZ Kolter",2022.0,arXiv preprint arXiv:2206.10550,arxiv.org,https://arxiv.org/abs/2206.10550,,158.0,2022-07-13 09:47:56,,,,,,,,,0,0.0,0.0,3.0,1.0,"… predictions as is required for randomized smoothing to obtain a robustness certificate. … empirical robustness to adversarial examples, as evaluated by robustness under adversarial …",https://arxiv.org/pdf/2206.10550,,,,,,,,,,,,,,,,,,,,,,,,,,,,,,,,
-,No,4.2 Learning and Optimization with the Human in the Loop,T,132,170,3.0,"A Passerini, M Sebag",2015.0,"Dagstuhl Reports, Vol. 4, Issue 10 ISSN …",drops.dagstuhl.de,https://drops.dagstuhl.de/opus/volltexte/2015/4900/pdf/dagrep-v004-i010-complete.pdf#page=23,https://scholar.google.com/scholar?cites=11456463136361874078&as_sdt=2005&sciodt=2007&hl=en,19.0,2022-07-13 09:24:19,PDF,,,,,,,,3,0.43,2.0,2.0,7.0,"… In L & O, f is mostly learned from data (with possible feedback from the human in the loop); in HIL, f is mostly learned from the the human in the loop. In all applications, the goal is twofold…",https://drops.dagstuhl.de/opus/volltexte/2015/4900/pdf/dagrep-v004-i010-complete.pdf#page=23,https://scholar.google.com/scholar?q=related:ngI1CYaI_Z4J:scholar.google.com/&scioq=%22robustness%22+%22artificial+intelligence%22+%22human+in+the+loop%22&hl=en&as_sdt=2007,,,,,,,,,,,,,,,,,,,,,,,,,,,,,,,
-,No,50 years of test (un) fairness: Lessons for machine learning,T,143,130,201.0,"B Hutchinson, M Mitchell",2019.0,"… on fairness, accountability, and transparency",dl.acm.org,https://dl.acm.org/doi/abs/10.1145/3287560.3287600?casa_token=Z2a8I6PzaHMAAAAA:nhzZarg-56YCKSz1foB7lN2dISAGlsarvONkhQHbLyWbjb37fWnS7vIe3qOutvbzHImq50cUl8xk8Q,https://scholar.google.com/scholar?cites=1225504947904294201&as_sdt=2005&sciodt=2007&hl=en,89.0,2022-07-14 10:15:05,,10.1145/3287560.3287600,,,,,,,201,67.0,101.0,2.0,3.0,"… years, including in education, hiring, and machine learning. We trace how the notion of fairness … to definitions of fairness in current machine learning research, and foreshadow current …",https://dl.acm.org/doi/pdf/10.1145/3287560.3287600?casa_token=d1wr2zzmGD0AAAAA:CZ-myCAJL2AxZL9HpOYwzySOiZGR0flqajZJxWVeHTBWUbbNAv2UEWzCKgSzDzlsr3r-nl78e3Y7bg,https://scholar.google.com/scholar?q=related:Oa1R0kHeAREJ:scholar.google.com/&scioq=%22robust%22+%22machine+learning%22+%22transparency%22&hl=en&as_sdt=2007,,,,,,,,,,,,,,,,,,,,,,,,,,,,,,,
"Unknown Unknowns, Robust",Yes,A -Distribution Based Operator for Enhancing Out of Distribution Robustness of Neural Network Classifiers,T,171,117,1.0,"N Antonello, PN Garner",2020.0,IEEE Signal Processing Letters,ieeexplore.ieee.org,https://ieeexplore.ieee.org/abstract/document/9115250/,https://scholar.google.com/scholar?cites=16743016879475944078&as_sdt=2005&sciodt=2007&hl=en,118.0,2022-07-13 10:25:08,,,,,,,,,1,0.5,1.0,2.0,2.0,"… Other techniques rely on learning confidence measures using … In this paper a novel method that produces reliable confidence … for benchmarking machine learning algorithms,” 2017, …",https://arxiv.org/pdf/2006.05389,https://scholar.google.com/scholar?q=related:jmqIwSQlW-gJ:scholar.google.com/&scioq=%22robustness%22+%22machine+learning%22+%22confidence%22&hl=en&as_sdt=2007,,,,,,,,,,,,,,,,,,,,,,,,,,,,,,,
-,No,A 30-year case study and 15 principles: Implications of an artificial intelligence methodology for functional modeling,T,189,189,45.0,Ashok K. Goel,2013.0,,,,,190.0,2022-07-13 09:20:03,,10.1017/S0890060413000218,,,,,,,45,5.0,45.0,1.0,9.0,"Abstract Research on design and analysis of complex systems has led to many functional representations with several meanings of function. This work on conceptual design uses a family of representations called structure–behavior–function (SBF) models. The SBF family ranges from behavior–function models of abstract design patterns to drawing–shape–SBF models that couple SBF models with visuospatial knowledge of technological systems. Development of SBF modeling is an instance of cognitively oriented artificial intelligence research that seeks to understand human cognition and build intelligent agents for addressing complex tasks such as design. This paper first traces the development of SBF modeling as our perspective on design evolved from that of problem solving to that of memory and learning. Next, the development of SBF modeling as a case study is used to abstract some of the core principles of an artificial intelligence methodology for functional modeling. Finally, some implications of the artificial intelligence methodology for different meanings of function are examined.",,,,,,,,,,,,,,,,,,,,,,,,,,,,,,,,,
-,No,A BCI challenge for the signal processing community: considering the user in the loop,T,201,192,18.0,"F. Lotte, C. Jeunet, J. Mladenović, B. N'Kaoua, L. Pillette",2018.0,,,,,193.0,2022-07-13 09:24:21,,10.1049/PBCE114E_CH8,,,,,,,18,4.5,4.0,5.0,4.0,"Electroencephalography (EEG)-based brain-computer interfaces (BCIs) have proven promising for a wide range of applications, from communication and control for motor impaired users to gaming targeted at the general public, real-time mental state monitoring and stroke rehabilitation, to name a few. Despite this promising potential, BCIs are still scarcely used outside laboratories for practical applications. The main reason preventing EEG-based BCIs from being widely used is arguably their poor usability, which is notably due to their low robustness and reliability. To operate a BCI, the user has to encode commands in his/her EEG signals, typically using mental imagery tasks, such as imagining hand movement or mental calculation. The execution of these tasks leads to specific EEG patterns, which the machine has to decode by using signal processing and machine learning. So far, to address the reliability issue of BCI, most research efforts have been focused on command decoding only. However, if the user is unable to encode commands in her EEG patterns, no signal-processing algorithm would be able to decode them. Therefore, we argue in this chapter that BCI design is not only a decoding challenge (i.e., translating EEG signals into control commands) but also a human-computer interaction challenge, which aims at ensuring the user can control the BCI. Interestingly enough, there are a number of open challenges to take the user into account, for which signal-processing and machine-learning methods could provide solutions. These challenges notably concerns (1) the modeling of the user and (2) understanding and improving how and what the user is learning. More precisely, the BCI community should first work on user modeling, i.e., modeling and updating the user's states and skills overtime from his/herEEG signals, behavior, BCI performances and possibly other sensors. The community should also identify new performance metrics-beyond classification accuracy-that could better describe users' skills at BCI control. Second, the BCI community has to understand how and what the user learns to control the BCI. This includes thoroughly identifying the features to be extracted and the classifier to be used to ensure the user's understanding of the feedback resulting from them, as well as how to present this feedback. Being able to update machine-learning parameters in a specific manner and a precise moment to favor learning without confusing the user with the ever-changeable feedback is another challenge. Finally, it is necessary to gain a clearer understanding of the reasons why mental commands are sometimes correctly decoded and sometimes not; what makes people sometimes fail at BCI control, in order to be able to guide them to do better. Overall, this chapter identifies a number of open and important challenges for the BCI community, at the user level, to which experts in machine learning and signal processing could contribute.",,,,,,,,,,,,,,,,,,,,,,,,,,,,,,,,,
-,No,A Balance Feedback Human Machine Interface for Humanoid Teleoperation in Dynamic Tasks,T,205,6,0.0,"Joao Ramos, Albert Wang, Sangbae Kim, IEEE",2015.0,2015 Ieee/Rsj International Conference On Intelligent Robots And Systems (Iros),,,,7.0,2022-07-13 15:02:00,Proceedings Paper,,2153-0858,,,,4229.0,4235.0,0,0.0,0.0,4.0,7.0,,,,,,,,,,,,,,,,,,,,,,,,,,,,,,,,,,
"Adversarial Attacks, Robust, Deep Learning",Yes,A Brief Introduction to Visual Adversarial Samples,T,248,180,1.0,W. Wang,2020.0,Journal of Cyber Security,,,https://www.scopus.com/inward/citedby.uri?partnerID=HzOxMe3b&scp=85083710476&origin=inward,181.0,2022-07-12 16:24:02,Article,10.19363/J.cnki.cn10-1380/tn.2020.02.04,2096-1146,https://api.elsevier.com/content/abstract/scopus_id/85083710476,5.0,2.0,39.0,48.0,1,0.5,1.0,1.0,2.0,,,,,,,,,,,,,,,,,,,,,,,,,,,,,,,,,,
"Saliency, Convolutional Networks, Explainability",Discussion,A Comparison of Saliency Methods for Deep Learning Explainability,T,310,192,0.0,"S Konate, L Lebrat, R Santa Cruz…",2021.0,2021 Digital Image …,ieeexplore.ieee.org,https://ieeexplore.ieee.org/abstract/document/9647419/,,193.0,2022-07-14 09:50:02,,,,,,,,,0,0.0,0.0,4.0,1.0,… Neural networks for machine learning have drawn significant … -based algorithms have explainability limitations. The first … of outlier images and are not robust enough to debug neural …,https://eprints.qut.edu.au/228483/1/DICTA_saliency.pdf,https://scholar.google.com/scholar?q=related:5gahQGZS-QgJ:scholar.google.com/&scioq=%22robust%22+%22machine+learning%22+%22explainability%22&hl=en&as_sdt=2007,,,,,,,,,,,,,,,,,,,,,,,,,,,,,,,
"Spiking Neural Network, Adversarial Examples, Resilience",Yes,A Comprehensive Analysis on Adversarial Robustness of Spiking Neural Networks,T,313,168,17.0,"Saima Sharmin, P. Panda, Syed Shakib Sarwar, Chankyu Lee, Wachirawit Ponghiran, K. Roy",2019.0,,,,,169.0,2022-07-13 09:19:22,,10.1109/IJCNN.2019.8851732,,,,,,,17,6.07,3.0,6.0,3.0,"In this era of machine learning models, their functionality is being threatened by adversarial attacks. In the face of this struggle for making artificial neural networks robust, finding a model, resilient to these attacks, is very important. In this work, we present, for the first time, a comprehensive analysis of the behavior of more bio-plausible networks, namely Spiking Neural Network (SNN) under state-of-the-art adversarial tests. We perform a comparative study of the accuracy degradation between conventional VGG-9 Artificial Neural Network (ANN) and equivalent spiking network with CIFAR-10 dataset in both whitebox and blackbox setting for different types of single-step and multi-step FGSM (Fast Gradient Sign Method) attacks. We demonstrate that SNNs tend to show more resiliency compared to ANN under blackbox attack scenario. Additionally, we find that SNN robustness is largely dependent on the corresponding training mechanism. We observe that SNNs trained by spike-based backpropagation are more adversarially robust than the ones obtained by ANN-to-SNN conversion rules in several whitebox and blackbox scenarios. Finally, we also propose a simple, yet, effective framework for crafting adversarial attacks from SNNs. Our results suggest that attacks crafted from SNNs following our proposed method are much stronger than those crafted from ANNs.",,,,,,,,,,,,,,,,,,,,,,,,,,,,,,,,,
"Graph Neural Network, Adversarial Attacks, Interpretability",Yes,"A Comprehensive Survey on Trustworthy Graph Neural Networks: Privacy, Robustness, Fairness, and Explainability",T,316,131,1.0,"E Dai, T Zhao, H Zhu, J Xu, Z Guo, H Liu, J Tang…",2022.0,arXiv preprint arXiv …,arxiv.org,https://arxiv.org/abs/2204.08570,https://scholar.google.com/scholar?cites=15220919062935286572&as_sdt=2005&sciodt=2007&hl=en,132.0,2022-07-12 11:56:04,,,,,,,,,1,1.0,0.0,8.0,1.0,"… In this paper, we give a comprehensive survey of GNNs in the computational aspects of privacy, robustness, fairness, and explainability. For each aspect, we give the taxonomy of the …",https://arxiv.org/pdf/2204.08570,https://scholar.google.com/scholar?q=related:LLM6bT6RO9MJ:scholar.google.com/&scioq=%22robustness%22+%22artificial+intelligence%22+%22explainability%22&hl=en&as_sdt=2007,,,,,,,,,,,,,,,,,,,,,,,,,,,,,,,
"Robustness, Regularization, Neural Network",Yes,A Consistency Regularization for Certified Robust Neural Networks,T,330,188,0.0,"M Xu, T Zhang, Z Li, D Zhang",2021.0,… Conference on Artificial Intelligence,Springer,https://link.springer.com/chapter/10.1007/978-3-030-93049-3_3,,189.0,2022-07-14 08:45:17,,10.1007/978-3-030-93049-3_3,,,,,,,0,0.0,0.0,4.0,1.0,"… of robust constraint and original accuracy … accuracy as well as certified robustness of the network. However, for misclassified examples, the constraints on robustness and accuracy are …",,https://scholar.google.com/scholar?q=related:470AnYgltUIJ:scholar.google.com/&scioq=%22robust%22+%22artificial+intelligence%22+%22accuracy%22&hl=en&as_sdt=2007,,,,,,,,,,,,,,,,,,,,,,,,,,,,,,,
"Recurrent Neural Network, Stability, Robustness",Yes,A Convex Parameterization of Robust Recurrent Neural Networks,T,336,173,7.0,M. Revay,2021.0,IEEE Control Systems Letters,,,https://www.scopus.com/inward/citedby.uri?partnerID=HzOxMe3b&scp=85096842800&origin=inward,174.0,2022-07-12 16:26:49,Article,10.1109/LCSYS.2020.3038221,2475-1456,https://api.elsevier.com/content/abstract/scopus_id/85096842800,5.0,4.0,1363.0,1368.0,7,7.0,7.0,1.0,1.0,,,,,,,,,,,,,,,,,,,,,,,,,,,,,,,,,,
-,No,A Critical Review of Surrogate Assisted Robust Design Optimization,T,345,49,0.0,"Tanmoy Chatterjee, Souvik Chakraborty, Rajib Chowdhury",2019.0,Archives Of Computational Methods In Engineering,,,,50.0,2022-07-15 11:21:17,Review,10.1007/s11831-017-9240-5,1134-3060,,26.0,1.0,245.0,274.0,0,0.0,0.0,3.0,3.0,,,,,,,,,,,,,,,,,,,,,,,,,,,,,,,,,,
"Unknown Unknowns, Human-in-the-Loop, Recurrent Neural Network",Discussion,A Crowdsourcing Based Human-in-the-Loop Framework for Denoising UUs in Relation Extraction Tasks,T,349,167,0.0,"M Li, J Jin, W Wu, Y Yang, L He…",2019.0,2019 International Joint …,ieeexplore.ieee.org,https://ieeexplore.ieee.org/abstract/document/8851951/,,168.0,2022-07-14 12:00:14,,,,,,,,,0,0.0,0.0,6.0,3.0,"… achieve a relative good performance compared to traditional machine learning methods [1], [2]… Qin, “Robust distant supervision relation extraction via deep reinforcement learning,” arXiv …",,https://scholar.google.com/scholar?q=related:hTl23y4q2-MJ:scholar.google.com/&scioq=%22robust%22+%22machine+learning%22+%22human+in+the+loop%22&hl=en&as_sdt=2007,,,,,,,,,,,,,,,,,,,,,,,,,,,,,,,
-,No,A Deep Learning Approach for Robust Detection of Bots in Twitter Using Transformers,T,369,19,6.0,"David Martín-Gutiérrez, Gustavo Hernández-Peñaloza, Alberto Belmonte Hernández, Alicia Lozano-Diez, Federico Álvarez",2021.0,,,,,20.0,2022-07-13 09:34:35,,10.1109/ACCESS.2021.3068659,,,,,,,6,6.0,1.0,5.0,1.0,"During the last decades, the volume of multimedia content posted in social networks has grown exponentially and such information is immediately propagated and consumed by a significant number of users. In this scenario, the disruption of fake news providers and bot accounts for spreading propaganda information as well as sensitive content throughout the network has fostered applied research to automatically measure the reliability of social networks accounts via Artificial Intelligence (AI). In this paper, we present a multilingual approach for addressing the bot identification task in Twitter via Deep learning (DL) approaches to support end-users when checking the credibility of a certain Twitter account. To do so, several experiments were conducted using state-of-the-art Multilingual Language Models to generate an encoding of the text-based features of the user account that are later on concatenated with the rest of the metadata to build a potential input vector on top of a Dense Network denoted as Bot-DenseNet. Consequently, this paper assesses the language constraint from previous studies where the encoding of the user account only considered either the metadata information or the metadata information together with some basic semantic text features. Moreover, the Bot-DenseNet produces a low-dimensional representation of the user account which can be used for any application within the Information Retrieval (IR) framework.",,,,,,,,,,,,,,,,,,,,,,,,,,,,,,,,,
"Adversarial Attacks, Embedding, Malware",Discussion,A Deep Learning-based Fine-grained Hierarchical Learning Approach for Robust Malware Classification,T,379,136,3.0,"Ahmed A. Abusnaina, M. Abuhamad, Hisham Alasmary, Afsah Anwar, Rhongho Jang, Saeed Salem, Daehun Nyang, David A. Mohaisen",2020.0,,,,,137.0,2022-07-13 09:38:44,,10.1109/tdsc.2021.3097296,,,,,,,3,1.5,0.0,8.0,2.0,"The wide acceptance of Internet of Things (IoT) for both household and industrial applications is accompanied by several security concerns. A major security concern is their probable abuse by adversaries towards their malicious intent. Understanding and analyzing IoT malicious behaviors is crucial, especially with their rapid growth and adoption in wide-range of applications. However, recent studies have shown that machine learning-based approaches are susceptible to adversarial attacks by adding junk codes to the binaries, for example, with an intention to fool those machine learning or deep learning-based detection systems. Realizing the importance of addressing this challenge, this study proposes a malware detection system that is robust to adversarial attacks. To do so, examine the performance of the state-of-the-art methods against adversarial IoT software crafted using the graph embedding and augmentation techniques. In particular, we study the robustness of such methods against two black-box adversarial methods, GEA and SGEA, to generate Adversarial Examples (AEs) with reduced overhead, and keeping their practicality intact. Our comprehensive experimentation with GEA-based AEs show the relation between misclassification and the graph size of the injected sample. Upon optimization and with small perturbation, by use of SGEA, all the IoT malware samples are misclassified as benign. This highlights the vulnerability of current detection systems under adversarial settings. With the landscape of possible adversarial attacks, we then propose DL-FHMC, a fine-grained hierarchical learning approach for malware detection and classification, that is robust to AEs with a capability to detect 88.52% of the malicious AEs.",,,,,,,,,,,,,,,,,,,,,,,,,,,,,,,,,
-,No,A Deep Neural Network for Robust Feature Extraction,T,383,76,1.0,M Becker,2017.0,Hochschule Düsseldorf–University of Applied Sciences,researchgate.net,https://www.researchgate.net/profile/Martin-Becker-13/publication/334544898_A_Deep_Neural_Network_For_Robust_Feature_Extraction/links/5d3086b6299bf1547cc202f3/A-Deep-Neural-Network-For-Robust-Feature-Extraction.pdf,https://scholar.google.com/scholar?cites=2055828426856696688&as_sdt=2005&sciodt=2007&hl=en,77.0,2022-07-14 12:10:31,PDF,,,,,,,,1,0.2,1.0,1.0,5.0,"… to obtain a semi-supervised, more robust feature extractor that we named ReNDA (short for … In the following, we give a detailed introduction and explanation of the ReNDA approach as …",https://www.researchgate.net/profile/Martin-Becker-13/publication/334544898_A_Deep_Neural_Network_For_Robust_Feature_Extraction/links/5d3086b6299bf1547cc202f3/A-Deep-Neural-Network-For-Robust-Feature-Extraction.pdf,https://scholar.google.com/scholar?q=related:cIvx3Q_FhxwJ:scholar.google.com/&scioq=%22robust%22+%22neural+network%22+%22explanation%22&hl=en&as_sdt=2007,,,,,,,,,,,,,,,,,,,,,,,,,,,,,,,
-,No,A Design Flow for Robust License Plate Localization and Recognition in Complex Scenes,T,394,121,34.0,"D. Wazalwar, E. Oruklu, J. Saniie",2012.0,,,,,122.0,2022-07-13 10:08:00,,10.4236/JTTS.2012.21002,,,,,,,34,3.4,11.0,3.0,10.0,"In this paper, we present a new design flow for robust license plate localization and recognition. The algorithm consists of three stages: 1) license plate localization; 2) character segmentation; and 3) feature extraction and character recognition. The algorithm uses Mexican hat operator for edge detection and Euler number of a binary image for identifying the license plate region. A pre-processing step using median filter and contrast enhancement is employed to improve the character segmentation performance in case of low resolution and blur images. A unique feature vector comprised of region properties, projection data and reflection symmetry coefficient has been proposed. Back propagation artificial neural network classifier has been used to train and test the neural network based on the extracted feature. A thorough testing of algorithm is performed on a database with varying test cases in terms of illumination and different plate conditions. Practical considerations like existence of another text block in an image, presence of dirt or shadow on or near license plate region, license plate with rows of characters and sensitivity to license plate dimensions have been addressed. The results are encouraging with success rate of 98.10% for license plate localization and 97.05% for character recognition.",,,,,,,,,,,,,,,,,,,,,,,,,,,,,,,,,
"Graph Convolutional Networks, Robust, Explainability",Discussion,A Feature-Importance-Aware and Robust Aggregator for GCN,T,432,74,3.0,L. Zhang,2020.0,"International Conference on Information and Knowledge Management, Proceedings",,,https://www.scopus.com/inward/citedby.uri?partnerID=HzOxMe3b&scp=85095864528&origin=inward,75.0,2022-07-12 16:28:09,Conference Paper,10.1145/3340531.3411983,,https://api.elsevier.com/content/abstract/scopus_id/85095864528,,,1813.0,1822.0,3,1.5,3.0,1.0,2.0,,,,,,,,,,,,,,,,,,,,,,,,,,,,,,,,,,
