,,Evaluating robust features on deep neural networks for speech recognition in noisy and channel mismatched conditions,T,2102,136,44.0,"V. Mitra, Weiqi Wang, H. Franco, Yun Lei, C. Bartels, M. Graciarena",2014.0,,,,,137.0,2022-07-13 09:29:07,,,,,,,,,44,5.5,7.0,6.0,8.0,"Deep Neural Network (DNN) based acoustic models have shown significant improvement over their Gaussian Mixture Model (GMM) counterparts in the last few years. While several studies exist that evaluate the performance of GMM systems under noisy and channel degraded conditions, noise robustness studies on DNN systems have been far fewer. In this work we present a study exploring both conventional DNNs and deep Convolutional Neural Networks (CNN) for noiseand channel-degraded speech recognition tasks using the Aurora4 dataset. We compare the baseline mel-filterbank energies with noise-robust features that we have proposed earlier and show that the use of robust features helps to improve the performance of DNNs or CNNs compared to melfilterbank energies. We also show that vocal tract length normalization has a positive role in improving the performance of the robust acoustic features. Finally, we show that by combining multiple systems together we can achieve even further improvement in recognition accuracy.",,,,,,,,,,,,,,,,,,,,,,,,,,,,,,,,,
,,Evaluating the robustness of bayesian neural networks against different types of attacks,T,2143,193,3.0,"Y Pang, S Cheng, J Hu, Y Liu",2021.0,arXiv preprint arXiv:2106.09223,arxiv.org,https://arxiv.org/abs/2106.09223,https://scholar.google.com/scholar?cites=2795260331369990544&as_sdt=2005&sciodt=2007&hl=en,194.0,2022-07-13 11:20:18,,,,,,,,,3,3.0,1.0,4.0,1.0,… of adversary’s knowledge. White-box attacks typically acquire the full knowledge of the model… ongoing malicious activities toward the deploy machine learning systems. This leads to the …,https://arxiv.org/pdf/2106.09223,https://scholar.google.com/scholar?q=related:kIkMInbCyiYJ:scholar.google.com/&scioq=%22robustness%22+%22machine+learning%22+%22knowledge%22&hl=en&as_sdt=2007,,,,,,,,,,,,,,,,,,,,,,,,,,,,,,,
,,Evaluating the robustness of neural networks: An extreme value theory approach,T,2148,3,299.0,"TW Weng, H Zhang, PY Chen, J Yi, D Su, Y Gao…",2018.0,arXiv preprint arXiv …,arxiv.org,https://arxiv.org/abs/1801.10578,https://scholar.google.com/scholar?cites=2078120094241692942&as_sdt=2005&sciodt=2007&hl=en,4.0,2022-07-13 14:59:54,,,,,,,,,299,75.15.00,43.0,7.0,4.0,"… analysis of an arbitrary neural network classifier, we … our knowledge, CLEVER is the first robustness metric that is attack-independent and can be applied to any arbitrary neural network …",https://arxiv.org/pdf/1801.10578,https://scholar.google.com/scholar?q=related:Dp3gITf31hwJ:scholar.google.com/&scioq=%22robustness%22+%22neural+network%22+%22knowledge%22&hl=en&as_sdt=2007,,,,,,,,,,,,,,,,,,,,,,,,,,,,,,,
,,Evaluation and Analysis of Robustness of Adversarial Examples Attacks in Deep Neural Networks,T,2162,27,1.0,"Asmaa Ftaimi, T. Mazri",2020.0,,,,,28.0,2022-07-13 09:19:17,,10.1109/ISAECT50560.2020.9523659,,,,,,,1,0.5,1.0,2.0,2.0,"Neural networks have revolutionized the field of artificial intelligence. They have given rise to several applications in various areas. However, it has been shown that they have flaws that could be leveraged by an attacker to perform an adversarial examples attack. Several studies have attempted to design defensive mechanisms that would ensure the security of neural networks. Nevertheless, these mitigation techniques remain insufficient to entirely address all the vulnerabilities that may reside in these architectures. In this article, we will extensively address the security of neural networks. We will begin with a study of the different approaches towards the security of neural networks. Then, we will detail significant sources of vulnerabilities in neural networks. Afterward, we will examine the theory of adversarial examples attack as well as the optimization problem related to them. Thereafter, we will conduct a comparative study of the most common mitigation techniques in the literature. Finally, we will propose a framework devoted to assessing adversarial examples robustness.",,,,,,,,,,,,,,,,,,,,,,,,,,,,,,,,,
,,Evaluation and Design of Robust Neural Network Defenses,T,2166,131,5.0,Nicholas Carlini,2018.0,,,,,132.0,2022-07-13 09:26:34,,,,,,,,,5,1.25,5.0,1.0,4.0,"Author(s): Carlini, Nicholas | Advisor(s): Wagner, David | Abstract: Neural networks provide state-of-the-art results for most machine learning tasks. Unfortunately, neural networks are vulnerable to test-time evasion attacks adversarial examples): inputs specifically designed by an adversary to cause a neural network to misclassify them. This makes applying neural networks in security-critical areas concerning.In this dissertation, we introduce a general framework for evaluating the robustness of neural network through optimization-based methods. We apply our framework to two different domains, image recognition and automatic speech recognition, and find it provides state-of-the-art results for both. To further demonstrate the power of our methods, we apply our attacks to break 14 defenses that have been proposed to alleviate adversarial examples.We then turn to the problem of designing a secure classifier. Given this apparently-fundamental vulnerability of neural networks to adversarial examples, instead of taking an existing classifier and attempting to make it robust, we construct a new classifier which is provably robust by design under a restricted threat model. We consider the domain of malware classification, and construct a neural network classifier that is can not be fooled by an insertion adversary, who can only insert new functionality, and not change existing functionality.We hope this dissertation will provide a useful starting point for both evaluating and constructing neural networks robust in the presence of an adversary.",,,,,,,,,,,,,,,,,,,,,,,,,,,,,,,,,
,,Evaluation of domain generalization and adaptation on improving model robustness to temporal dataset shift in clinical medicine,T,2220,40,10.0,"LL Guo, SR Pfohl, J Fries, AEW Johnson, J Posada…",2022.0,Scientific reports,nature.com,https://www.nature.com/articles/s41598-022-06484-1,https://scholar.google.com/scholar?cites=12289502842706704255&as_sdt=2005&sciodt=2007&hl=en,41.0,2022-07-13 10:25:08,HTML,,,,,,,,10,10.0,2.0,6.0,1.0,… reported the median and 95% confidence interval (CI) of … robustness in non-stationary health records: Caveats to deployable model performance in common clinical machine learning …,https://www.nature.com/articles/s41598-022-06484-1,https://scholar.google.com/scholar?q=related:f7evDbkVjaoJ:scholar.google.com/&scioq=%22robustness%22+%22machine+learning%22+%22confidence%22&hl=en&as_sdt=2007,,,,,,,,,,,,,,,,,,,,,,,,,,,,,,,
,,Evaluations and Methods for Explanation through Robustness Analysis,T,2257,110,21.0,"Cheng-Yu Hsieh, Chih-Kuan Yeh, Xuanqing Liu, Pradeep Ravikumar, Seungyeon Kim, Sanjiv Kumar, Cho-Jui Hsieh",2019.0,,,,,111.0,2022-07-13 09:22:24,,,,,,,,,21,7.0,3.0,7.0,3.0,"Among multiple ways of interpreting a machine learning model, measuring the importance of a set of features tied to a prediction is probably one of the most intuitive ways to explain a model. In this paper, we establish the link between a set of features to a prediction with a new evaluation criterion, robustness analysis, which measures the minimum distortion distance of adversarial perturbation. By measuring the tolerance level for an adversarial attack, we can extract a set of features that provides the most robust support for a prediction, and also can extract a set of features that contrasts the current prediction to a target class by setting a targeted adversarial attack. By applying this methodology to various prediction tasks across multiple domains, we observe the derived explanations are indeed capturing the significant feature set qualitatively and quantitatively.",,,,,,,,,,,,,,,,,,,,,,,,,,,,,,,,,
,,Explainable AI for Inspecting Adversarial Attacks on Deep Neural Networks,T,2497,57,1.0,"Zuzanna Klawikowska, Agnieszka Mikołajczyk, M. Grochowski",2020.0,,,,,58.0,2022-07-13 09:19:22,,10.1007/978-3-030-61401-0_14,,,,,,,1,0.5,0.0,3.0,2.0,,,,,,,,,,,,,,,,,,,,,,,,,,,,,,,,,,
,,Exploiting Causal Structure for Robust Model Selection in Unsupervised Domain Adaptation,T,2759,36,2.0,"T Kyono, M Van der Schaar",2021.0,… on Artificial Intelligence,ieeexplore.ieee.org,https://ieeexplore.ieee.org/abstract/document/9503312/?casa_token=_cuDVKycFMYAAAAA:Yk5Kswadfs3-1z97-stWTbpCAKTAUESUDEvA6WfZw3DjmsAELGytsPMhfvtV0XZ0K4Ew9WNvtQ,https://scholar.google.com/scholar?cites=12184960631579600665&as_sdt=2005&sciodt=2007&hl=en,199.0,2022-07-14 09:24:50,,,,,,,,,2,2.0,1.0,2.0,1.0,… We thoroughly analyze our method under oracle knowledge using synthetic data. We then … We thoroughly analyze our method under oracle knowledge using synthetic data. We then …,https://ieeexplore.ieee.org/iel7/9078688/9184921/09503312.pdf?casa_token=LTjQumzH-twAAAAA:RDeFyQod6x2GTypTgMITZ-ZGuPkXAQnwTuhN1gCZdOXHYR2FFEFoPHEPuednetHxYR1X0DSh2g,https://scholar.google.com/scholar?q=related:GedrvyKtGakJ:scholar.google.com/&scioq=%22robust%22+%22artificial+intelligence%22+%22knowledge%22&hl=en&as_sdt=2007,,,,,,,,,,,,,,,,,,,,,,,,,,,,,,,
,,Exploiting Context for Robustness to Label Noise in Active Learning,T,2763,80,2.0,"S Paul, S Chandrasekaran, BS Manjunath…",2020.0,arXiv preprint arXiv …,arxiv.org,https://arxiv.org/abs/2010.09066,https://scholar.google.com/scholar?cites=1078588678279443821&as_sdt=2005&sciodt=2007&hl=en,81.0,2022-07-13 11:05:20,,,,,,,,,2,1.0,1.0,4.0,2.0,"… learning strategy, we analyze the robustness of different active learning techniques when combined with CNLD. Figure 4 illustrates the robustness of our proposed approach for different …",https://arxiv.org/pdf/2010.09066,https://scholar.google.com/scholar?q=related:bbWaM7Dq9w4J:scholar.google.com/&scioq=%22robustness%22+%22machine+learning%22+%22noise%22&hl=en&as_sdt=2007,,,,,,,,,,,,,,,,,,,,,,,,,,,,,,,
,,Exploiting joint robustness to adversarial perturbations,T,2770,20,16.0,"A Dabouei, S Soleymani…",2020.0,Proceedings of the …,openaccess.thecvf.com,http://openaccess.thecvf.com/content_CVPR_2020/html/Dabouei_Exploiting_Joint_Robustness_to_Adversarial_Perturbations_CVPR_2020_paper.html,https://scholar.google.com/scholar?cites=15434727618344741324&as_sdt=2005&sciodt=2007&hl=en,21.0,2022-07-12 11:56:54,,,,,,,,,16,8.0,5.0,3.0,2.0,"… Considering ℓp-norm as the distance metric to measure the magnitude of perturbations, we define the robustness to adversarial examples or, more specifically, adversarial perturbations …",https://openaccess.thecvf.com/content_CVPR_2020/papers/Dabouei_Exploiting_Joint_Robustness_to_Adversarial_Perturbations_CVPR_2020_paper.pdf,https://scholar.google.com/scholar?q=related:zGlZAP4qM9YJ:scholar.google.com/&scioq=%22robustness%22+%22artificial+intelligence%22+%22adversarial%22&hl=en&as_sdt=2007,,,,,,,,,,,,,,,,,,,,,,,,,,,,,,,
,,Exploring Misclassifications of Robust Neural Networks to Enhance Adversarial Attacks,T,2830,198,7.0,"Leo Schwinn, René Raab, A. Nguyen, Dario Zanca, B. Eskofier",2021.0,,,,,199.0,2022-07-13 09:27:43,,,,,,,,,7,7.0,1.0,5.0,1.0,"Progress in making neural networks more robust against adversarial attacks is mostly marginal, despite the great efforts of the research community. Moreover, the robustness evaluation is often imprecise, making it difficult to identify promising approaches. We analyze the classification decisions of 19 different state-of-the-art neural networks trained to be robust against adversarial attacks. Our findings suggest that current untargeted adversarial attacks induce misclassification towards only a limited amount of different classes. Additionally, we observe that both overand under-confidence in model predictions result in an inaccurate assessment of model robustness. Based on these observations, we propose a novel loss function for adversarial attacks that consistently improves attack success rate compared to prior loss functions for 19 out of 19 analyzed models.",,,,,,,,,,,,,,,,,,,,,,,,,,,,,,,,,
,,Exploring Robustness of Unsupervised Domain Adaptation in Semantic Segmentation,T,2837,49,6.0,"Jinyu Yang, Chunyuan Li, Weizhi An, Hehuan Ma, Yuzhi Guo, Yu Rong, P. Zhao, Junzhou Huang",2021.0,,,,,50.0,2022-07-13 09:28:33,,10.1109/iccv48922.2021.00906,,,,,,,6,6.0,1.0,8.0,1.0,"Recent studies imply that deep neural networks are vulnerable to adversarial examples, i.e., inputs with a slight but intentional perturbation are incorrectly classified by the network. Such vulnerability makes it risky for some security-related applications (e.g., semantic segmentation in autonomous cars) and triggers tremendous concerns on the model reliability. For the first time, we comprehensively evaluate the robustness of existing UDA methods and propose a robust UDA approach. It is rooted in two observations: i) the robustness of UDA methods in semantic segmentation remains unexplored, which poses a security concern in this field; and ii) although commonly used self-supervision (e.g., rotation and jigsaw) benefits model robustness in classification and recognition tasks, they fail to provide the critical supervision signals that are essential in semantic segmentation. These observations motivate us to propose adversarial self-supervision UDA (or ASSUDA) that maximizes the agreement between clean images and their adversarial examples by a contrastive loss in the output space. Extensive empirical studies on commonly used benchmarks demonstrate that ASSUDA is resistant to adversarial attacks.",,,,,,,,,,,,,,,,,,,,,,,,,,,,,,,,,
,,Exploring the Impact of Data Poisoning Attacks on Machine Learning Model Reliability,T,2865,182,1.0,"L Verde, F Marulli, S Marrone",2021.0,Procedia Computer Science,Elsevier,https://www.sciencedirect.com/science/article/pii/S1877050921017695,https://scholar.google.com/scholar?cites=17266716305657614010&as_sdt=2005&sciodt=2007&hl=en,183.0,2022-07-12 13:42:35,,,,,,,,,1,1.0,0.0,3.0,1.0,"… adversaries at phases of artificial intelligence. Poisoned data … the lower bound of classifier robustness useful to evaluate each … In this work, we evaluate the reliability and resilience of …",https://www.sciencedirect.com/science/article/pii/S1877050921017695/pdf?md5=dd6f8c520531ace4d0b03e8a0fd05ca8&pid=1-s2.0-S1877050921017695-main.pdf,https://scholar.google.com/scholar?q=related:us4qPP-yn-8J:scholar.google.com/&scioq=%22robustness%22+%22artificial+intelligence%22+%22resilience%22&hl=en&as_sdt=2007,,,,,,,,,,,,,,,,,,,,,,,,,,,,,,,
,,Exponentiated Gradient Reweighting for Robust Training Under Label Noise and Beyond,T,2908,34,5.0,"Negin Majidi, E. Amid, Hossein Talebi, Manfred K. Warmuth",2021.0,,,,,35.0,2022-07-13 10:05:55,,,,,,,,,5,5.0,1.0,4.0,1.0,"Many learning tasks in machine learning can be viewed as taking a gradient step towards minimizing the average loss of a batch of examples in each training iteration. When noise is prevalent in the data, this uniform treatment of examples can lead to overfitting to noisy examples with larger loss values and result in poor generalization. Inspired by the expert setting in on-line learning, we present a flexible approach to learning from noisy examples. Specifically, we treat each training example as an expert and maintain a distribution over all examples. We alternate between updating the parameters of the model using gradient descent and updating the example weights using the exponentiated gradient update. Unlike other related methods, our approach handles a general class of loss functions and can be applied to a wide range of noise types and applications. We show the efficacy of our approach for multiple learning settings, namely noisy principal component analysis and a variety of noisy classification problems.",,,,,,,,,,,,,,,,,,,,,,,,,,,,,,,,,
,,Expressive 1-lipschitz neural networks for robust multiple graph learning against adversarial attacks,T,2918,58,8.0,"X Zhao, Z Zhang, Z Zhang, L Wu, J Jin…",2021.0,International …,proceedings.mlr.press,http://proceedings.mlr.press/v139/zhao21e.html,https://scholar.google.com/scholar?cites=13407308401883474864&as_sdt=2005&sciodt=2007&hl=en,59.0,2022-07-13 17:19:08,,,,,,,,,8,8.0,1.0,6.0,1.0,… expressive and robust multiple graph learning against adversarial attacks. … robust graph learning models and Lipschitz-bound neural architectures. We validate that the proposed robust …,http://proceedings.mlr.press/v139/zhao21e/zhao21e.pdf,https://scholar.google.com/scholar?q=related:sOtf4PRTELoJ:scholar.google.com/&scioq=%22robust%22+%22artificial+intelligence%22+%22adversarial%22&hl=en&as_sdt=2007,,,,,,,,,,,,,,,,,,,,,,,,,,,,,,,
,,Extension to Multidimensional Problems of a Fuzzy- based Explainable & Noise-Resilient Algorithm,T,2931,14,3.0,"Javier Viaña, Kelly Cohen",2021.0,,,,,15.0,2022-07-13 09:19:55,,,,,,,,,3,3.0,2.0,2.0,1.0,"While Deep Neural Networks (DNNs) have shown incredible performance in a variety of data, they are brittle and opaque: easily fooled by the presence of noise, and difficult to understand the underlying reasoning for their predictions or choices. This focus on accuracy at the expense of interpretability and robustness caused little concern since, until recently, DNNs were employed primarily for scientific and limited commercial work. An increasing, widespread use of artificial intelligence and growing emphasis on user data protections, however, motivates the need for robust solutions with explainable methods and results. In this work, we extend a novel fuzzy based algorithm for regression to multidimensional problems. Previous research demonstrated that this approach outperforms neural network benchmarks while using only 5% of the number of the parameters.",,,,,,,,,,,,,,,,,,,,,,,,,,,,,,,,,
,,FaiRR: Faithful and robust deductive reasoning over natural language,T,3137,72,3.0,"S Sanyal, H Singh, X Ren",2022.0,arXiv preprint arXiv:2203.10261,arxiv.org,https://arxiv.org/abs/2203.10261,https://scholar.google.com/scholar?cites=12349261321618606307&as_sdt=2005&sciodt=2007&hl=en,73.0,2022-07-13 18:08:11,,,,,,,,,3,3.0,1.0,3.0,1.0,"… reasoning capabilities in a more comprehensive way, we experiment with both existing deductive reasoning … Overall, we find that FAIRR is more robust to novel language perturbations …",https://arxiv.org/pdf/2203.10261,https://scholar.google.com/scholar?q=related:40iMKb5jYasJ:scholar.google.com/&scioq=%22robust%22+%22artificial+intelligence%22+%22reasoning%22&hl=en&as_sdt=2007,,,,,,,,,,,,,,,,,,,,,,,,,,,,,,,
,,Fast Robustness Prediction for Deep Neural Network,T,3210,35,2.0,"Yue-Huan Wang, Zenan Li, Jingwei Xu, Ping Yu, Xiaoxing Ma",2019.0,,,,,36.0,2022-07-13 09:26:17,,10.1145/3361242.3361243,,,,,,,2,1.07,0.0,5.0,3.0,"Deep neural networks (DNNs) have achieved impressive performance in many difficult tasks. However, DNN models are essentially uninterpretable to humans, and unfortunately prone to adversarial attacks, which hinders their adoption in security and safety-critical scenarios. The robustness of a DNN model, which measures its stableness against adversarial attacks, becomes an important topic in both the machine learning and the software engineering communities. Analytical evaluation of DNN robustness is difficult due to the high-dimensionality of inputs, the huge amount of parameters, and the nonlinear network structure. In practice, the degree of robustness of DNNs is empirically approximated with adversarial searching, which is computationally expensive and cannot be applied in resource constrained settings such as embedded computing. In this paper, we propose to predict the robustness of a DNN model for each input with another DNN model, which takes the output of neurons of the former model as input. We train a regression model to encode the connections between output of the penultimate layer of a DNN model and its robustness. With this trained model, the robustness for an input can be predicted instantaneously. Experiments with MNIST and CIFAR10 datasets and LeNet, VGG and ResNet DNN models were conducted to evaluate the efficacy of the proposed approach. The results indicated that our approach achieved 0.05-0.21 mean absolute errors and significantly outperformed confidence and surprise adequacy-based approaches.",,,,,,,,,,,,,,,,,,,,,,,,,,,,,,,,,
,,Fast and robust neural network joint models for statistical machine translation,T,3262,9,618.0,"J Devlin, R Zbib, Z Huang, T Lamar…",2014.0,proceedings of the …,aclanthology.org,https://aclanthology.org/P14-1129.pdf,https://scholar.google.com/scholar?cites=8457362692808600645&as_sdt=2005&sciodt=2007&hl=en,10.0,2022-07-14 13:30:21,PDF,,,,,,,,618,77.25.00,124.0,5.0,8.0,"… By contrast, our α parameter allows us to carefully choose the optimal trade-off between neural network accuracy and mean selfnormalization error. In future work, we will thoroughly …",https://aclanthology.org/P14-1129.pdf,https://scholar.google.com/scholar?q=related:RWx_YY-WXnUJ:scholar.google.com/&scioq=%22robust%22+%22neural+network%22+%22accuracy%22&hl=en&as_sdt=2007,,,,,,,,,,,,,,,,,,,,,,,,,,,,,,,
,,Faster meta update strategy for noise-robust deep learning,T,3303,14,12.0,"Y Xu, L Zhu, L Jiang, Y Yang",2021.0,Proceedings of the IEEE/CVF …,openaccess.thecvf.com,http://openaccess.thecvf.com/content/CVPR2021/html/Xu_Faster_Meta_Update_Strategy_for_Noise-Robust_Deep_Learning_CVPR_2021_paper.html,https://scholar.google.com/scholar?cites=7111457941814893962&as_sdt=2005&sciodt=2007&hl=en,15.0,2022-07-14 09:04:21,,,,,,,,,12,12.0,3.0,4.0,1.0,… CNWL dataset; 2) it demonstrates our consistent improvement across all noise rates as a useful and robust feature since the underlying noise rate is often unknown in practice. …,http://openaccess.thecvf.com/content/CVPR2021/papers/Xu_Faster_Meta_Update_Strategy_for_Noise-Robust_Deep_Learning_CVPR_2021_paper.pdf,https://scholar.google.com/scholar?q=related:it0B6VH5sGIJ:scholar.google.com/&scioq=%22robust%22+%22artificial+intelligence%22+%22noise%22&hl=en&as_sdt=2007,,,,,,,,,,,,,,,,,,,,,,,,,,,,,,,
,,Feature Purification: How Adversarial Training Performs Robust Deep Learning,T,3397,75,50.0,"Zeyuan Allen-Zhu, Yuanzhi Li",2020.0,,,,,76.0,2022-07-13 10:08:07,,10.1109/FOCS52979.2021.00098,,,,,,,50,25.0,25.0,2.0,2.0,"Despite the empirical success of using adversarial training to defend deep learning models against adversarial perturbations, so far, it still remains rather unclear what the principles are behind the existence of adversarial perturbations, and what adversarial training does to the neural network to remove them. In this paper, we present a principle that we call feature purification, where we show one of the causes of the existence of adversarial examples is the accumulation of certain small dense mixtures in the hidden weights during the training process of a neural network; and more importantly, one of the goals of adversarial training is to remove such mixtures to purify hidden weights. We present both experiments on the CIFAR-10 dataset to illustrate this principle, and a theoretical result proving that for certain natural classification tasks, training a two-layer neural network with ReLU activation using randomly initialized gradient descent indeed satisfies this principle. Technically, we give, to the best of our knowledge, the first re-sult proving that the following two can hold simultaneously for training a neural network with ReLU activation. (1) Training over the original data is indeed non-robust to small adversarial perturbations of some radius. (2) Adversarial training, even with an empirical perturbation algorithm such as FGM, can in fact be provably robust against any perturbations of the same radius. Finally, we also prove a complexity lower bound, showing that low complexity models such as linear classifiers, low-degree polynomials, or even the neural tangent kernel for this network, cannot defend against perturbations of this same radius, no matter what algorithms are used to train them. 11The full version of this paper can be found at https://arxiv.org/abs/-2005.l0190.",,,,,,,,,,,,,,,,,,,,,,,,,,,,,,,,,
,,Feature Vulnerability and Robustness Assessment against Adversarial Machine Learning Attacks,T,3411,7,2.0,"Andrew McCarthy, Panagiotis Andriotis, Essam Ghadafi, Phil Legg",2021.0,,,,,8.0,2022-07-13 09:22:57,,10.1109/CyberSA52016.2021.9478199,,,,,,,2,2.0,1.0,4.0,1.0,"Whilst machine learning has been widely adopted for various domains, it is important to consider how such techniques may be susceptible to malicious users through adversarial attacks. Given a trained classifier, a malicious attack may attempt to craft a data observation whereby the data features purposefully trigger the classifier to yield incorrect responses. This has been observed in various image classification tasks, including falsifying road sign detection and facial recognition, which could have severe consequences in real-world deployment. In this work, we investigate how these attacks could impact on network traffic analysis, and how a system could perform misclassification of common network attacks such as DDoS attacks. Using the CICIDS2017 data, we examine how vulnerable the data features used for intrusion detection are to perturbation attacks using FGSM adversarial examples. As a result, our method provides a defensive approach for assessing feature robustness that seeks to balance between classification accuracy whilst minimising the attack surface of the feature space.",,,,,,,,,,,,,,,,,,,,,,,,,,,,,,,,,
